{"server_key_id":"vendor-statements-test-001","server_signature":"f5c6644b055428be19cd01173e9569f0e6939a3f420750925f7812be2b71451bb8915660d6f229d72eeeadf41d9b24ab9749bb85129a039f36ea93687ca82102","statement":{"affiliation":{"known_since":"2026-01-01T00:45:00.000Z","periods":[]},"chain_id":"1fde6568-43b6-4784-89b9-1542adaacf4f","forks":[],"forks_omitted":0,"kind":"ledger.anchor_history.v2","next_since_tree_size":null,"owner_keys":["4fee164bf8ab3b3fd7fde4bf8878d5f38578a7e092aab3160a40192102adfa1a"],"predecessor":null,"reference_tree_size":28,"roots":[{"merkle_root":"3561d72a43ee05040df62b98b4e89682efd120e4bd3ae993a10420e186496088","recorded_as":"countersigned","server_ts":"2026-01-01T00:30:01.000Z","tree_size":15},{"merkle_root":"c46496cde2b2a1bd4258ab57a52d06417f2e322c1301da131099b9911d51033b","recorded_as":"countersigned","server_ts":"2026-01-01T01:00:01.000Z","tree_size":28}],"server_ts":"2026-01-01T01:02:00.000Z","since_tree_size":0,"successor":null,"truncated":false},"statement_jcs":"{\"affiliation\":{\"known_since\":\"2026-01-01T00:45:00.000Z\",\"periods\":[]},\"chain_id\":\"1fde6568-43b6-4784-89b9-1542adaacf4f\",\"forks\":[],\"forks_omitted\":0,\"kind\":\"ledger.anchor_history.v2\",\"next_since_tree_size\":null,\"owner_keys\":[\"4fee164bf8ab3b3fd7fde4bf8878d5f38578a7e092aab3160a40192102adfa1a\"],\"predecessor\":null,\"reference_tree_size\":28,\"roots\":[{\"merkle_root\":\"3561d72a43ee05040df62b98b4e89682efd120e4bd3ae993a10420e186496088\",\"recorded_as\":\"countersigned\",\"server_ts\":\"2026-01-01T00:30:01.000Z\",\"tree_size\":15},{\"merkle_root\":\"c46496cde2b2a1bd4258ab57a52d06417f2e322c1301da131099b9911d51033b\",\"recorded_as\":\"countersigned\",\"server_ts\":\"2026-01-01T01:00:01.000Z\",\"tree_size\":28}],\"server_ts\":\"2026-01-01T01:02:00.000Z\",\"since_tree_size\":0,\"successor\":null,\"truncated\":false}"}
