{"server_key_id":"vendor-statements-test-001","server_signature":"8180df6a957a60bbe99004889c99cf6b7eb2d58b6d8ac7eb9845b42a9029476a496e5a29e9aa7c3a121a684073593a88df90d6a627033c67422130ff81edeb01","statement":{"affiliation":{"known_since":"2025-12-01T00:00:00.000Z","periods":[]},"chain_id":"7f1cd28c-d219-4bee-b9f1-577f2bfa6d1e","forks":[],"forks_omitted":0,"kind":"ledger.anchor_history.v2","next_since_tree_size":16,"owner_keys":["920c29c31a05a9c1464714ffeb64032fd0f7879a2b7921831f90fa3e9ea3d189"],"predecessor":null,"reference_tree_size":28,"roots":[{"merkle_root":"d8759d7ba7ac37505ecaa86cac96cd7a42efc882ab4068c15ba8671579317c77","recorded_as":"countersigned","server_ts":"2026-01-01T00:30:01.000Z","tree_size":15}],"server_ts":"2026-01-01T01:02:00.000Z","since_tree_size":0,"successor":null,"truncated":true},"statement_jcs":"{\"affiliation\":{\"known_since\":\"2025-12-01T00:00:00.000Z\",\"periods\":[]},\"chain_id\":\"7f1cd28c-d219-4bee-b9f1-577f2bfa6d1e\",\"forks\":[],\"forks_omitted\":0,\"kind\":\"ledger.anchor_history.v2\",\"next_since_tree_size\":16,\"owner_keys\":[\"920c29c31a05a9c1464714ffeb64032fd0f7879a2b7921831f90fa3e9ea3d189\"],\"predecessor\":null,\"reference_tree_size\":28,\"roots\":[{\"merkle_root\":\"d8759d7ba7ac37505ecaa86cac96cd7a42efc882ab4068c15ba8671579317c77\",\"recorded_as\":\"countersigned\",\"server_ts\":\"2026-01-01T00:30:01.000Z\",\"tree_size\":15}],\"server_ts\":\"2026-01-01T01:02:00.000Z\",\"since_tree_size\":0,\"successor\":null,\"truncated\":true}"}
