{"server_key_id":"vendor-statements-test-001","server_signature":"9db7d6f6f68116a31c7ebe80116dae5f0261c6d2fbc033282cca2db43145f52d88fb9e102b65154cdaeb68d8f401a15d9067aba4a822d8231cf849294ca8e007","statement":{"affiliation":{"known_since":"2025-12-01T00:00:00.000Z","periods":[{"bases":["common_control"],"from":"2025-06-01T00:00:00.000Z","merged":false,"recorded_ts":"2025-06-01T00:00:00.000Z","until":null}]},"chain_id":"c4ad78c8-c165-4e2c-86ae-715e6e2b29c7","forks":[],"forks_omitted":0,"kind":"ledger.anchor_history.v2","next_since_tree_size":null,"owner_keys":["e65bcadafc3519de873bf77840b9ebf20998da99ba1e5a02e9c97f5b4c8ace3d"],"predecessor":null,"reference_tree_size":0,"roots":[],"server_ts":"2026-01-01T00:10:00.000Z","since_tree_size":0,"successor":null,"truncated":false},"statement_jcs":"{\"affiliation\":{\"known_since\":\"2025-12-01T00:00:00.000Z\",\"periods\":[{\"bases\":[\"common_control\"],\"from\":\"2025-06-01T00:00:00.000Z\",\"merged\":false,\"recorded_ts\":\"2025-06-01T00:00:00.000Z\",\"until\":null}]},\"chain_id\":\"c4ad78c8-c165-4e2c-86ae-715e6e2b29c7\",\"forks\":[],\"forks_omitted\":0,\"kind\":\"ledger.anchor_history.v2\",\"next_since_tree_size\":null,\"owner_keys\":[\"e65bcadafc3519de873bf77840b9ebf20998da99ba1e5a02e9c97f5b4c8ace3d\"],\"predecessor\":null,\"reference_tree_size\":0,\"roots\":[],\"server_ts\":\"2026-01-01T00:10:00.000Z\",\"since_tree_size\":0,\"successor\":null,\"truncated\":false}"}
