{"server_key_id":"vendor-statements-test-001","server_signature":"7b1ab671a0aea27a6a0f95a2a9bbb19abb02b5554daf2ea122c56037481410da5e81fa2a57f31b32dead8fa3fffce813adebcf94bd40dabed2b2886936298600","statement":{"affiliation":{"known_since":"2025-12-01T00:00:00.000Z","periods":[]},"chain_id":"81c0909b-ece5-4db4-997c-f125d3340b97","forks":[],"forks_omitted":0,"kind":"ledger.anchor_history.v2","next_since_tree_size":null,"owner_keys":["34a1ede16620f6674bf73e7a479e1c13e94137fa237deb503e67f7edf5437d56"],"predecessor":null,"reference_tree_size":28,"roots":[{"merkle_root":"c16255c1c2f5087a32e59bdaa1d4aa4c72e2e612b4f2656fb7867e31125ff3cb","recorded_as":"countersigned","server_ts":"2026-01-01T01:00:01.000Z","tree_size":28},{"merkle_root":"56491700ce697a07304cc185b8338642ca9dfab12423b4ab3047e439aa0ec068","recorded_as":"countersigned","server_ts":"2026-01-01T00:30:01.000Z","tree_size":15}],"server_ts":"2026-01-01T01:02:05.000Z","since_tree_size":0,"successor":null,"truncated":false},"statement_jcs":"{\"affiliation\":{\"known_since\":\"2025-12-01T00:00:00.000Z\",\"periods\":[]},\"chain_id\":\"81c0909b-ece5-4db4-997c-f125d3340b97\",\"forks\":[],\"forks_omitted\":0,\"kind\":\"ledger.anchor_history.v2\",\"next_since_tree_size\":null,\"owner_keys\":[\"34a1ede16620f6674bf73e7a479e1c13e94137fa237deb503e67f7edf5437d56\"],\"predecessor\":null,\"reference_tree_size\":28,\"roots\":[{\"merkle_root\":\"c16255c1c2f5087a32e59bdaa1d4aa4c72e2e612b4f2656fb7867e31125ff3cb\",\"recorded_as\":\"countersigned\",\"server_ts\":\"2026-01-01T01:00:01.000Z\",\"tree_size\":28},{\"merkle_root\":\"56491700ce697a07304cc185b8338642ca9dfab12423b4ab3047e439aa0ec068\",\"recorded_as\":\"countersigned\",\"server_ts\":\"2026-01-01T00:30:01.000Z\",\"tree_size\":15}],\"server_ts\":\"2026-01-01T01:02:05.000Z\",\"since_tree_size\":0,\"successor\":null,\"truncated\":false}"}
