{"server_key_id":"vendor-statements-test-001","server_signature":"57a3c6dc095cbff1b4491a6e99a900afcb0e132769ee5d8f40a268dd5a90469893bd30e9d4dc09af40b094d1c51da5e238e64c53355d9241c57097d059635206","statement":{"affiliation":{"known_since":"2025-12-01T00:00:00.000Z","periods":[]},"chain_id":"da237c2a-d0d3-47dd-9766-3f5f6686e964","forks":[],"forks_omitted":0,"kind":"ledger.anchor_history.v2","next_since_tree_size":16,"owner_keys":["2174fef743fde2ab2c0e7146ca8cbef2d5b2e7dc610a38cdb44cc652ba68054a"],"predecessor":null,"reference_tree_size":28,"roots":[{"merkle_root":"08eb3b269a0c99313907455e202b0c488aa8946623c0b9ee216ed0a760609eee","recorded_as":"countersigned","server_ts":"2026-01-01T00:30:01.000Z","tree_size":15}],"server_ts":"2026-01-01T01:02:00.000Z","since_tree_size":0,"successor":null,"truncated":true},"statement_jcs":"{\"affiliation\":{\"known_since\":\"2025-12-01T00:00:00.000Z\",\"periods\":[]},\"chain_id\":\"da237c2a-d0d3-47dd-9766-3f5f6686e964\",\"forks\":[],\"forks_omitted\":0,\"kind\":\"ledger.anchor_history.v2\",\"next_since_tree_size\":16,\"owner_keys\":[\"2174fef743fde2ab2c0e7146ca8cbef2d5b2e7dc610a38cdb44cc652ba68054a\"],\"predecessor\":null,\"reference_tree_size\":28,\"roots\":[{\"merkle_root\":\"08eb3b269a0c99313907455e202b0c488aa8946623c0b9ee216ed0a760609eee\",\"recorded_as\":\"countersigned\",\"server_ts\":\"2026-01-01T00:30:01.000Z\",\"tree_size\":15}],\"server_ts\":\"2026-01-01T01:02:00.000Z\",\"since_tree_size\":0,\"successor\":null,\"truncated\":true}"}
