{"server_key_id":"vendor-statements-test-001","server_signature":"210c88fef8f5b787a9e17d1ac155246286d3388712f17e345db1537fd3a6c45b9db4e0fcc735c2e47b47cb7e31329666000d1a960d6ca07a7866795a3d4fb601","statement":{"affiliation":{"known_since":"2025-12-01T00:00:00.000Z","periods":[]},"chain_id":"ecc04925-378f-4ef5-9318-8d71f6531cf6","forks":[],"forks_omitted":0,"kind":"ledger.anchor_history.v2","next_since_tree_size":null,"owner_keys":["066aaa4109d55f553d595fae326b07b940582ba8f3977d21d9af4a3dcb914000"],"predecessor":null,"reference_tree_size":28,"roots":[{"merkle_root":"0f5c1d904636409b1c6e844c2e52237dac576b1c274b3ff360118effe443d892","recorded_as":"countersigned","server_ts":"2026-01-01T00:30:01.000Z","tree_size":15},{"merkle_root":"3b0f547bbc5abdd97abd88a87a57f5df868bab00f2aa03fddd7d09adb38390af","recorded_as":"countersigned","server_ts":"2026-01-01T01:00:01.000Z","tree_size":28}],"server_ts":"2026-01-01T01:02:00.000Z","since_tree_size":0,"successor":null,"truncated":false},"statement_jcs":"{\"affiliation\":{\"known_since\":\"2025-12-01T00:00:00.000Z\",\"periods\":[]},\"chain_id\":\"ecc04925-378f-4ef5-9318-8d71f6531cf6\",\"forks\":[],\"forks_omitted\":0,\"kind\":\"ledger.anchor_history.v2\",\"next_since_tree_size\":null,\"owner_keys\":[\"066aaa4109d55f553d595fae326b07b940582ba8f3977d21d9af4a3dcb914000\"],\"predecessor\":null,\"reference_tree_size\":28,\"roots\":[{\"merkle_root\":\"0f5c1d904636409b1c6e844c2e52237dac576b1c274b3ff360118effe443d892\",\"recorded_as\":\"countersigned\",\"server_ts\":\"2026-01-01T00:30:01.000Z\",\"tree_size\":15},{\"merkle_root\":\"3b0f547bbc5abdd97abd88a87a57f5df868bab00f2aa03fddd7d09adb38390af\",\"recorded_as\":\"countersigned\",\"server_ts\":\"2026-01-01T01:00:01.000Z\",\"tree_size\":28}],\"server_ts\":\"2026-01-01T01:02:00.000Z\",\"since_tree_size\":0,\"successor\":null,\"truncated\":false}"}
