{"server_key_id":"vendor-statements-test-001","server_signature":"04e7e96e3188240c07e359252bf90a1a8b9304241f0b4fdeff785b8a6886657661c0f87ff667fbd0392ca8e186c0975c2055a50673aece9f0ff1f77995497f01","statement":{"affiliation":{"known_since":"2025-12-01T00:00:00.000Z","periods":[]},"chain_id":"366d7a4b-a02b-46ca-a208-f3ebe13a1409","forks":[],"forks_omitted":0,"kind":"ledger.anchor_history.v2","next_since_tree_size":null,"owner_keys":["f4cbdc1c9a4d2caba49bfdf93ce10017852cc5812e2e0c22da2050265fbe6ee0"],"predecessor":null,"reference_tree_size":28,"roots":[{"merkle_root":"6a3b6dca0d56cdcb1315421fa42785d32136de7f820c1a759444dda79434cb55","recorded_as":"countersigned","server_ts":"2026-01-01T00:30:01.000Z","tree_size":15},{"merkle_root":"7368a2a5d8780e91cfd337597fcb48cd3c3c4d990114ec6da89f091c2a3deb4c","recorded_as":"countersigned","server_ts":"2026-01-01T01:00:01.000Z","tree_size":28}],"server_ts":"2026-01-01T01:02:00.000Z","since_tree_size":0,"successor":{"chain_id":"c41ba49d-14e4-4fbf-8e76-79b7b4d009ec","tree_size":20},"truncated":false},"statement_jcs":"{\"affiliation\":{\"known_since\":\"2025-12-01T00:00:00.000Z\",\"periods\":[]},\"chain_id\":\"366d7a4b-a02b-46ca-a208-f3ebe13a1409\",\"forks\":[],\"forks_omitted\":0,\"kind\":\"ledger.anchor_history.v2\",\"next_since_tree_size\":null,\"owner_keys\":[\"f4cbdc1c9a4d2caba49bfdf93ce10017852cc5812e2e0c22da2050265fbe6ee0\"],\"predecessor\":null,\"reference_tree_size\":28,\"roots\":[{\"merkle_root\":\"6a3b6dca0d56cdcb1315421fa42785d32136de7f820c1a759444dda79434cb55\",\"recorded_as\":\"countersigned\",\"server_ts\":\"2026-01-01T00:30:01.000Z\",\"tree_size\":15},{\"merkle_root\":\"7368a2a5d8780e91cfd337597fcb48cd3c3c4d990114ec6da89f091c2a3deb4c\",\"recorded_as\":\"countersigned\",\"server_ts\":\"2026-01-01T01:00:01.000Z\",\"tree_size\":28}],\"server_ts\":\"2026-01-01T01:02:00.000Z\",\"since_tree_size\":0,\"successor\":{\"chain_id\":\"c41ba49d-14e4-4fbf-8e76-79b7b4d009ec\",\"tree_size\":20},\"truncated\":false}"}
