{"server_key_id":"vendor-statements-test-001","server_signature":"5d6b9c4af0bd0ed53d7fbfeac922f36234b60da7af130c5d9a1407a3b6213edffb2b7a86290049515e414982ccde2a074a8414ece78f6a00e42b866d4aa5e909","statement":{"affiliation":{"known_since":"2025-12-31T22:30:00.000Z","periods":[{"bases":["controlled_by_vendor"],"from":"2025-12-15T00:00:00.000Z","merged":false,"recorded_ts":"2025-12-31T21:00:00.000Z","until":"2025-12-31T22:00:00.000Z"}]},"chain_id":"1755296a-8e6d-4653-ad7f-ff35e4d5848e","forks":[],"forks_omitted":0,"kind":"ledger.anchor_history.v2","next_since_tree_size":null,"owner_keys":["ad1c81af6a678c0c356086ec9124c7b81ff70a152cb7f02020e1a84f7b47ce6a"],"predecessor":{"chain_id":"96f5166e-dc1f-4e77-95f7-c25928ea0c3e","tree_size":40},"reference_tree_size":28,"roots":[{"merkle_root":"aa3aed90e7ddbd52d9ec5a9d5bfc428b85c36640e496a457be69231805458fc0","recorded_as":"countersigned","server_ts":"2026-01-01T00:30:01.000Z","tree_size":15},{"merkle_root":"87473b75bda484cb53511fce96caa7144ea2b171dae460f0fd3c8de4318a8946","recorded_as":"countersigned","server_ts":"2026-01-01T01:00:01.000Z","tree_size":28}],"server_ts":"2026-01-01T01:02:00.000Z","since_tree_size":0,"successor":null,"truncated":false},"statement_jcs":"{\"affiliation\":{\"known_since\":\"2025-12-31T22:30:00.000Z\",\"periods\":[{\"bases\":[\"controlled_by_vendor\"],\"from\":\"2025-12-15T00:00:00.000Z\",\"merged\":false,\"recorded_ts\":\"2025-12-31T21:00:00.000Z\",\"until\":\"2025-12-31T22:00:00.000Z\"}]},\"chain_id\":\"1755296a-8e6d-4653-ad7f-ff35e4d5848e\",\"forks\":[],\"forks_omitted\":0,\"kind\":\"ledger.anchor_history.v2\",\"next_since_tree_size\":null,\"owner_keys\":[\"ad1c81af6a678c0c356086ec9124c7b81ff70a152cb7f02020e1a84f7b47ce6a\"],\"predecessor\":{\"chain_id\":\"96f5166e-dc1f-4e77-95f7-c25928ea0c3e\",\"tree_size\":40},\"reference_tree_size\":28,\"roots\":[{\"merkle_root\":\"aa3aed90e7ddbd52d9ec5a9d5bfc428b85c36640e496a457be69231805458fc0\",\"recorded_as\":\"countersigned\",\"server_ts\":\"2026-01-01T00:30:01.000Z\",\"tree_size\":15},{\"merkle_root\":\"87473b75bda484cb53511fce96caa7144ea2b171dae460f0fd3c8de4318a8946\",\"recorded_as\":\"countersigned\",\"server_ts\":\"2026-01-01T01:00:01.000Z\",\"tree_size\":28}],\"server_ts\":\"2026-01-01T01:02:00.000Z\",\"since_tree_size\":0,\"successor\":null,\"truncated\":false}"}
