{"server_key_id":"vendor-statements-test-001","server_signature":"f24b2746a19fff5331b3b4bcc1fc42413827a7769ecb4da010adeb555ecb7793a2ef71a3410ca302a6d5d0eda507c6d0b231892d0ca48ed14f36bb9d3dd2310b","statement":{"affiliation":{"known_since":"2025-12-01T00:00:00.000Z","periods":[]},"chain_id":"73840186-5b5b-4b45-acd8-e396284575c4","forks":[],"forks_omitted":0,"kind":"ledger.anchor_history.v2","next_since_tree_size":null,"owner_keys":["f21811cd9a4730397d81cd1ba7c7cfdeadcd78f7c78bb1d52546545d3c24dd07"],"predecessor":null,"reference_tree_size":28,"roots":[{"merkle_root":"bbef5f56801ddd6e6d730393006e1bfaa0ee97d7706c72a2254dda391e7043e3","recorded_as":"countersigned","server_ts":"2026-01-01T00:30:01.000Z","tree_size":15},{"merkle_root":"4b0b596fb4337276c6440de82c8de313349e07fb475deb37cb437c73ae21fe8a","recorded_as":"countersigned","server_ts":"2026-01-01T01:00:01.000Z","tree_size":28}],"server_ts":"2026-01-01T01:02:00.000Z","since_tree_size":0,"successor":null,"truncated":false},"statement_jcs":"{\"affiliation\":{\"known_since\":\"2025-12-01T00:00:00.000Z\",\"periods\":[]},\"chain_id\":\"73840186-5b5b-4b45-acd8-e396284575c4\",\"forks\":[],\"forks_omitted\":0,\"kind\":\"ledger.anchor_history.v2\",\"next_since_tree_size\":null,\"owner_keys\":[\"f21811cd9a4730397d81cd1ba7c7cfdeadcd78f7c78bb1d52546545d3c24dd07\"],\"predecessor\":null,\"reference_tree_size\":28,\"roots\":[{\"merkle_root\":\"bbef5f56801ddd6e6d730393006e1bfaa0ee97d7706c72a2254dda391e7043e3\",\"recorded_as\":\"countersigned\",\"server_ts\":\"2026-01-01T00:30:01.000Z\",\"tree_size\":15},{\"merkle_root\":\"4b0b596fb4337276c6440de82c8de313349e07fb475deb37cb437c73ae21fe8a\",\"recorded_as\":\"countersigned\",\"server_ts\":\"2026-01-01T01:00:01.000Z\",\"tree_size\":28}],\"server_ts\":\"2026-01-01T01:02:00.000Z\",\"since_tree_size\":0,\"successor\":null,\"truncated\":false}"}
