{"server_key_id":"vendor-statements-test-001","server_signature":"0058ecf98c23d32147d1ab4892668ff0d23b149ce755c37e7e5ae558c9bc7e9e5e9896a432c95aede54c2b8550197179d03626a435dd82b532e563b64ce0130d","statement":{"affiliation":{"known_since":"2025-12-01T00:00:00.000Z","periods":[]},"chain_id":"85e788b0-17e8-4746-a549-fa889cda31e4","forks":[],"forks_omitted":0,"kind":"ledger.anchor_history.v2","next_since_tree_size":null,"owner_keys":["c388f66df77b3226b54e2a550e72f6c734572dda952d6870b9f6264f2336830f","cd8405e1f7c0c852b5be571702d5050cb1f8ca7301f52df7ce2081af6c2438b6"],"predecessor":null,"reference_tree_size":28,"roots":[{"merkle_root":"a87f338abc494a197e9d734c46fa49a57419bfebd09618ccd40ad25f6b5add0b","recorded_as":"countersigned","server_ts":"2026-01-01T00:30:01.000Z","tree_size":15},{"merkle_root":"2f02bd8f0040e4ccf62f8831fa089ec07a35ad35e4ec4eebbd3c0a4fb717eba4","recorded_as":"countersigned","server_ts":"2026-01-01T01:00:01.000Z","tree_size":28}],"server_ts":"2026-01-01T01:02:00.000Z","since_tree_size":0,"successor":null,"truncated":false},"statement_jcs":"{\"affiliation\":{\"known_since\":\"2025-12-01T00:00:00.000Z\",\"periods\":[]},\"chain_id\":\"85e788b0-17e8-4746-a549-fa889cda31e4\",\"forks\":[],\"forks_omitted\":0,\"kind\":\"ledger.anchor_history.v2\",\"next_since_tree_size\":null,\"owner_keys\":[\"c388f66df77b3226b54e2a550e72f6c734572dda952d6870b9f6264f2336830f\",\"cd8405e1f7c0c852b5be571702d5050cb1f8ca7301f52df7ce2081af6c2438b6\"],\"predecessor\":null,\"reference_tree_size\":28,\"roots\":[{\"merkle_root\":\"a87f338abc494a197e9d734c46fa49a57419bfebd09618ccd40ad25f6b5add0b\",\"recorded_as\":\"countersigned\",\"server_ts\":\"2026-01-01T00:30:01.000Z\",\"tree_size\":15},{\"merkle_root\":\"2f02bd8f0040e4ccf62f8831fa089ec07a35ad35e4ec4eebbd3c0a4fb717eba4\",\"recorded_as\":\"countersigned\",\"server_ts\":\"2026-01-01T01:00:01.000Z\",\"tree_size\":28}],\"server_ts\":\"2026-01-01T01:02:00.000Z\",\"since_tree_size\":0,\"successor\":null,\"truncated\":false}"}
