{"server_key_id":"vendor-statements-test-001","server_signature":"cd36427e3fd1262e48d41aa9c778de4b4d86fad5dc071e53123df41a93b324268a81073b004d87ce2126a66b24e8694af06a0314a952dffa85a1644feaca4f0d","statement":{"affiliation":{"known_since":"2025-12-01T00:00:00.000Z","periods":[]},"chain_id":"b297be34-02b0-4467-b55a-b445bc1f9433","forks":[],"forks_omitted":0,"kind":"ledger.anchor_history.v2","next_since_tree_size":null,"owner_keys":["7f62abd593f67f59660269c9a9e4c6ddbca68fd556fce99098d8d4a2163c0647"],"predecessor":null,"reference_tree_size":28,"roots":[{"merkle_root":"ffc1d2c7e4c02e0de013d18e6f3512493af19cad1e357d913f8e15e804425450","recorded_as":"countersigned","server_ts":"2026-01-01T00:30:01.000Z","tree_size":15},{"merkle_root":"fba9c400e827d4a8d06970a091732695ea592f9c1e9311537cb4d487916205b4","recorded_as":"countersigned","server_ts":"2026-01-01T01:00:01.000Z","tree_size":28}],"server_ts":"2026-01-01T01:02:00.000Z","since_tree_size":0,"successor":null,"truncated":false},"statement_jcs":"{\"affiliation\":{\"known_since\":\"2025-12-01T00:00:00.000Z\",\"periods\":[]},\"chain_id\":\"b297be34-02b0-4467-b55a-b445bc1f9433\",\"forks\":[],\"forks_omitted\":0,\"kind\":\"ledger.anchor_history.v2\",\"next_since_tree_size\":null,\"owner_keys\":[\"7f62abd593f67f59660269c9a9e4c6ddbca68fd556fce99098d8d4a2163c0647\"],\"predecessor\":null,\"reference_tree_size\":28,\"roots\":[{\"merkle_root\":\"ffc1d2c7e4c02e0de013d18e6f3512493af19cad1e357d913f8e15e804425450\",\"recorded_as\":\"countersigned\",\"server_ts\":\"2026-01-01T00:30:01.000Z\",\"tree_size\":15},{\"merkle_root\":\"fba9c400e827d4a8d06970a091732695ea592f9c1e9311537cb4d487916205b4\",\"recorded_as\":\"countersigned\",\"server_ts\":\"2026-01-01T01:00:01.000Z\",\"tree_size\":28}],\"server_ts\":\"2026-01-01T01:02:00.000Z\",\"since_tree_size\":0,\"successor\":null,\"truncated\":false}"}
