{"server_key_id":"vendor-statements-test-001","server_signature":"0cd0d1dd8231c48181425b2439b74af343d4bb131ce97769033917f8e4081110f2822a5da5ebd3ad42d362dbfbd15278bfaf0a15daccab4081bddf4f0f793901","statement":{"affiliation":{"known_since":"2025-12-01T00:00:00.000Z","periods":[]},"chain_id":"9533701f-6e00-4f7c-9b16-5904e33e7212","forks":[],"forks_omitted":0,"kind":"ledger.anchor_history.v2","next_since_tree_size":null,"owner_keys":["e49f37151c0e17b9781c5fe96901f5683e316c706fa299782e1d3498861a8bd1"],"predecessor":null,"reference_tree_size":28,"roots":[{"merkle_root":"734556f5cb2e45924bf2e5f7c0901d237b26a18df908f7e3a9a3d953d9da6f98","recorded_as":"countersigned","server_ts":"2026-01-01T00:30:01.000Z","tree_size":15},{"merkle_root":"6c54f93266864053c7ea73c689a1bbc0b9d0c9c20d167cb3c2b0c00ea7376432","recorded_as":"countersigned","server_ts":"2026-01-01T01:00:01.000Z","tree_size":28}],"server_ts":"2026-01-01T01:02:00.000Z","since_tree_size":0,"successor":null,"truncated":false},"statement_jcs":"{\"affiliation\":{\"known_since\":\"2025-12-01T00:00:00.000Z\",\"periods\":[]},\"chain_id\":\"9533701f-6e00-4f7c-9b16-5904e33e7212\",\"forks\":[],\"forks_omitted\":0,\"kind\":\"ledger.anchor_history.v2\",\"next_since_tree_size\":null,\"owner_keys\":[\"e49f37151c0e17b9781c5fe96901f5683e316c706fa299782e1d3498861a8bd1\"],\"predecessor\":null,\"reference_tree_size\":28,\"roots\":[{\"merkle_root\":\"734556f5cb2e45924bf2e5f7c0901d237b26a18df908f7e3a9a3d953d9da6f98\",\"recorded_as\":\"countersigned\",\"server_ts\":\"2026-01-01T00:30:01.000Z\",\"tree_size\":15},{\"merkle_root\":\"6c54f93266864053c7ea73c689a1bbc0b9d0c9c20d167cb3c2b0c00ea7376432\",\"recorded_as\":\"countersigned\",\"server_ts\":\"2026-01-01T01:00:01.000Z\",\"tree_size\":28}],\"server_ts\":\"2026-01-01T01:02:00.000Z\",\"since_tree_size\":0,\"successor\":null,\"truncated\":false}"}
