{"server_key_id":"vendor-statements-test-001","server_signature":"0df4205feb0aad4d090131acd0b360e3cd38a8a86e6f830f2384109770248ed3b0784d893bc1a5684dace2148e7f86787e18b6bdf8b8c27e363746617b8d7c03","statement":{"affiliation":{"known_since":"2025-12-01T00:00:00.000Z","periods":[{"bases":["common_control"],"from":"2025-06-01T00:00:00.000Z","merged":false,"recorded_ts":"2025-06-01T00:00:00.000Z","until":null}]},"chain_id":"241a0fc9-9328-4078-895a-ce29cdbc740f","forks":[],"forks_omitted":0,"kind":"ledger.anchor_history.v2","next_since_tree_size":null,"owner_keys":["24a665c54ae43fdc1e3fd8f8d6d06dfb9620dbe5fd115a15f0e25535f56592f9"],"predecessor":null,"reference_tree_size":15,"roots":[{"merkle_root":"5a0093ec163c9f6a75e7345dc34fb94539b2ed22dc6efc8538e6ce4b4d57a644","recorded_as":"countersigned","server_ts":"2026-01-01T00:30:01.000Z","tree_size":15}],"server_ts":"2026-01-01T00:40:00.000Z","since_tree_size":0,"successor":null,"truncated":false},"statement_jcs":"{\"affiliation\":{\"known_since\":\"2025-12-01T00:00:00.000Z\",\"periods\":[{\"bases\":[\"common_control\"],\"from\":\"2025-06-01T00:00:00.000Z\",\"merged\":false,\"recorded_ts\":\"2025-06-01T00:00:00.000Z\",\"until\":null}]},\"chain_id\":\"241a0fc9-9328-4078-895a-ce29cdbc740f\",\"forks\":[],\"forks_omitted\":0,\"kind\":\"ledger.anchor_history.v2\",\"next_since_tree_size\":null,\"owner_keys\":[\"24a665c54ae43fdc1e3fd8f8d6d06dfb9620dbe5fd115a15f0e25535f56592f9\"],\"predecessor\":null,\"reference_tree_size\":15,\"roots\":[{\"merkle_root\":\"5a0093ec163c9f6a75e7345dc34fb94539b2ed22dc6efc8538e6ce4b4d57a644\",\"recorded_as\":\"countersigned\",\"server_ts\":\"2026-01-01T00:30:01.000Z\",\"tree_size\":15}],\"server_ts\":\"2026-01-01T00:40:00.000Z\",\"since_tree_size\":0,\"successor\":null,\"truncated\":false}"}
