{"server_key_id":"vendor-statements-test-001","server_signature":"fb75d96b865ce331b0102b4bfb5de3dc18aff6708a8c1cde8e69a451498118877e4e95a29189586805fbaaa9291b18e7d8c5df78cad38af410538c01ae13c50d","statement":{"affiliation":{"known_since":"2025-12-01T00:00:00.000Z","periods":[]},"chain_id":"da237c2a-d0d3-47dd-9766-3f5f6686e964","forks":[],"forks_omitted":0,"kind":"ledger.anchor_history.v2","next_since_tree_size":null,"owner_keys":["2174fef743fde2ab2c0e7146ca8cbef2d5b2e7dc610a38cdb44cc652ba68054a"],"predecessor":null,"reference_tree_size":28,"roots":[{"merkle_root":"801a4944a9c198fd971040dab424efbf135c0936bab5bf7e3dce61279411dd39","recorded_as":"countersigned","server_ts":"2026-01-01T01:00:01.000Z","tree_size":28}],"server_ts":"2026-01-01T01:02:10.000Z","since_tree_size":20,"successor":null,"truncated":false},"statement_jcs":"{\"affiliation\":{\"known_since\":\"2025-12-01T00:00:00.000Z\",\"periods\":[]},\"chain_id\":\"da237c2a-d0d3-47dd-9766-3f5f6686e964\",\"forks\":[],\"forks_omitted\":0,\"kind\":\"ledger.anchor_history.v2\",\"next_since_tree_size\":null,\"owner_keys\":[\"2174fef743fde2ab2c0e7146ca8cbef2d5b2e7dc610a38cdb44cc652ba68054a\"],\"predecessor\":null,\"reference_tree_size\":28,\"roots\":[{\"merkle_root\":\"801a4944a9c198fd971040dab424efbf135c0936bab5bf7e3dce61279411dd39\",\"recorded_as\":\"countersigned\",\"server_ts\":\"2026-01-01T01:00:01.000Z\",\"tree_size\":28}],\"server_ts\":\"2026-01-01T01:02:10.000Z\",\"since_tree_size\":20,\"successor\":null,\"truncated\":false}"}
