{"server_key_id":"vendor-statements-test-001","server_signature":"46435b6d0c53d33295d3ba0eabafec5ac876b3c895639595ca44c751e08e2666cbc8796aa2cb640bf9792e15bf6d18f8d524c3913510f7879541c9ab1c3a2c01","statement":{"affiliation":{"known_since":"2025-12-01T00:00:00.000Z","periods":[{"bases":["participation"],"from":"2026-01-01T00:50:00.000Z","merged":false,"recorded_ts":"2026-01-01T01:02:02.000Z","until":null}]},"chain_id":"6421e58a-3880-461f-90f3-6fa4e3878140","forks":[],"forks_omitted":0,"kind":"ledger.anchor_history.v2","next_since_tree_size":null,"owner_keys":["32d4d6234baf6fa0bdea2094af8e83f4034166325ff9846715a6b617a806f42e"],"predecessor":null,"reference_tree_size":28,"roots":[{"merkle_root":"6a8b00d84caf5eafc48f48bae93c7dd0669aef4fa620eee83ef77c28dcbb079c","recorded_as":"countersigned","server_ts":"2026-01-01T00:30:01.000Z","tree_size":15},{"merkle_root":"70b251a69c373b9c66cf97010032c46c259fc14ea8a89526fe71f020b86fe6e1","recorded_as":"countersigned","server_ts":"2026-01-01T01:00:01.000Z","tree_size":28}],"server_ts":"2026-01-01T01:02:05.000Z","since_tree_size":0,"successor":null,"truncated":false},"statement_jcs":"{\"affiliation\":{\"known_since\":\"2025-12-01T00:00:00.000Z\",\"periods\":[{\"bases\":[\"participation\"],\"from\":\"2026-01-01T00:50:00.000Z\",\"merged\":false,\"recorded_ts\":\"2026-01-01T01:02:02.000Z\",\"until\":null}]},\"chain_id\":\"6421e58a-3880-461f-90f3-6fa4e3878140\",\"forks\":[],\"forks_omitted\":0,\"kind\":\"ledger.anchor_history.v2\",\"next_since_tree_size\":null,\"owner_keys\":[\"32d4d6234baf6fa0bdea2094af8e83f4034166325ff9846715a6b617a806f42e\"],\"predecessor\":null,\"reference_tree_size\":28,\"roots\":[{\"merkle_root\":\"6a8b00d84caf5eafc48f48bae93c7dd0669aef4fa620eee83ef77c28dcbb079c\",\"recorded_as\":\"countersigned\",\"server_ts\":\"2026-01-01T00:30:01.000Z\",\"tree_size\":15},{\"merkle_root\":\"70b251a69c373b9c66cf97010032c46c259fc14ea8a89526fe71f020b86fe6e1\",\"recorded_as\":\"countersigned\",\"server_ts\":\"2026-01-01T01:00:01.000Z\",\"tree_size\":28}],\"server_ts\":\"2026-01-01T01:02:05.000Z\",\"since_tree_size\":0,\"successor\":null,\"truncated\":false}"}
