{"server_key_id":"vendor-statements-test-001","server_signature":"487df4d570eb3c4ae55d9c2a2eb27af07b6731de2aaf76b2da80a8c10d9ff67fcb92e6f54787eed4167a3b8140d8684fbb850f38493b6792cdbf71a396aa5b06","statement":{"affiliation":{"known_since":"2025-12-01T00:00:00.000Z","periods":[]},"chain_id":"1c1d2978-6e85-40c2-8303-12798785705f","forks":[],"forks_omitted":0,"kind":"ledger.anchor_history.v2","next_since_tree_size":null,"owner_keys":["9e891f569ab461c996d814cec368016d6beb47bd5a5040709511738f93fa45d4"],"predecessor":null,"reference_tree_size":28,"roots":[{"merkle_root":"6ba837b1be80f89bc873b34d969342f8e5f0cd827515c21453c38fb36438b743","recorded_as":"countersigned","server_ts":"2026-01-01T00:30:01.000Z","tree_size":15},{"merkle_root":"7dfbb1a8af133a03b23953dad4aef8edd318a3f4b3a35381ffc51adea60d1d87","recorded_as":"countersigned","server_ts":"2026-01-01T01:00:01.000Z","tree_size":28}],"server_ts":"2026-01-01T01:02:00.000Z","since_tree_size":0,"successor":null,"truncated":false},"statement_jcs":"{\"affiliation\":{\"known_since\":\"2025-12-01T00:00:00.000Z\",\"periods\":[]},\"chain_id\":\"1c1d2978-6e85-40c2-8303-12798785705f\",\"forks\":[],\"forks_omitted\":0,\"kind\":\"ledger.anchor_history.v2\",\"next_since_tree_size\":null,\"owner_keys\":[\"9e891f569ab461c996d814cec368016d6beb47bd5a5040709511738f93fa45d4\"],\"predecessor\":null,\"reference_tree_size\":28,\"roots\":[{\"merkle_root\":\"6ba837b1be80f89bc873b34d969342f8e5f0cd827515c21453c38fb36438b743\",\"recorded_as\":\"countersigned\",\"server_ts\":\"2026-01-01T00:30:01.000Z\",\"tree_size\":15},{\"merkle_root\":\"7dfbb1a8af133a03b23953dad4aef8edd318a3f4b3a35381ffc51adea60d1d87\",\"recorded_as\":\"countersigned\",\"server_ts\":\"2026-01-01T01:00:01.000Z\",\"tree_size\":28}],\"server_ts\":\"2026-01-01T01:02:00.000Z\",\"since_tree_size\":0,\"successor\":null,\"truncated\":false}"}
