{"server_key_id":"vendor-statements-test-001","server_signature":"adbab624f5b0b4b18a34ea2217bb24ebe1580da9fd540ceb363c57c471c114649da8fa260993f76822b15ac93930c348b3c0bcc7b33f07533a49e7a2833b5e03","statement":{"affiliation":{"known_since":"2025-12-01T00:00:00.000Z","periods":[]},"chain_id":"3855f1b6-06fc-42e3-b2d0-ad0120d23799","forks":[],"forks_omitted":0,"kind":"ledger.anchor_history.v2","next_since_tree_size":null,"owner_keys":["053dc53b361ecab3c09b18dfaa4c0e4e9aaaaffc9576b8baf6bd451e4d2afac1"],"predecessor":null,"reference_tree_size":28,"roots":[{"merkle_root":"990e33a26e270fb9ba70fbca47cbbb99cc4545440f054554f40f6d73f6e72adc","recorded_as":"countersigned","server_ts":"2026-01-01T00:30:01.000Z","tree_size":15},{"merkle_root":"cbf1db0817d1926c7f7159af327efc389c70e1b79c0963dfa86f2daa88d6f5bf","recorded_as":"countersigned","server_ts":"2026-01-01T01:00:01.000Z","tree_size":28}],"server_ts":"2026-01-01T01:02:00.000Z","since_tree_size":0,"successor":null,"truncated":false},"statement_jcs":"{\"affiliation\":{\"known_since\":\"2025-12-01T00:00:00.000Z\",\"periods\":[]},\"chain_id\":\"3855f1b6-06fc-42e3-b2d0-ad0120d23799\",\"forks\":[],\"forks_omitted\":0,\"kind\":\"ledger.anchor_history.v2\",\"next_since_tree_size\":null,\"owner_keys\":[\"053dc53b361ecab3c09b18dfaa4c0e4e9aaaaffc9576b8baf6bd451e4d2afac1\"],\"predecessor\":null,\"reference_tree_size\":28,\"roots\":[{\"merkle_root\":\"990e33a26e270fb9ba70fbca47cbbb99cc4545440f054554f40f6d73f6e72adc\",\"recorded_as\":\"countersigned\",\"server_ts\":\"2026-01-01T00:30:01.000Z\",\"tree_size\":15},{\"merkle_root\":\"cbf1db0817d1926c7f7159af327efc389c70e1b79c0963dfa86f2daa88d6f5bf\",\"recorded_as\":\"countersigned\",\"server_ts\":\"2026-01-01T01:00:01.000Z\",\"tree_size\":28}],\"server_ts\":\"2026-01-01T01:02:00.000Z\",\"since_tree_size\":0,\"successor\":null,\"truncated\":false}"}
