{"server_key_id":"vendor-statements-test-001","server_signature":"fa0459c0e4d55247f817cc45e9b2c1306564e435be90f212a89cd4334d7a69318f99edfa69f2db13c7a40adade9fa01eb05768eabae9277eb251e322b50b930e","statement":{"affiliation":{"known_since":"2025-12-01T00:00:00.000Z","periods":[]},"chain_id":"44a5a5ea-3d79-47c9-9535-bc3fda622ea8","forks":[],"forks_omitted":0,"kind":"ledger.anchor_history.v2","next_since_tree_size":null,"owner_keys":["1d339e62e060f3bb65063af0308e7f71d8c494d7b08a1f1a3cd615e487f55c8f"],"predecessor":null,"reference_tree_size":35,"roots":[{"merkle_root":"dba35bea09258b78d170c9207b70d12ec48247b377730f88a7e5614de6039263","recorded_as":"countersigned","server_ts":"2026-01-01T00:30:01.000Z","tree_size":15},{"merkle_root":"b254a9023430b278a8bfd039f664b6f29aa220bc40389d332171e481552634ca","recorded_as":"countersigned","server_ts":"2026-01-01T01:00:01.000Z","tree_size":28},{"merkle_root":"71aa9ecd3fef1ced03de0aea20d9b50d1624f53afff94b3e12dd0b1aaced7287","recorded_as":"countersigned","server_ts":"2026-01-01T00:43:00.000Z","tree_size":34},{"merkle_root":"a3af9387eb35940f96974182b2639a65df08c5b0be59ff93cd82c552b0190a3e","recorded_as":"countersigned","server_ts":"2026-01-01T00:58:00.000Z","tree_size":35}],"server_ts":"2026-01-01T01:02:00.000Z","since_tree_size":0,"successor":null,"truncated":false},"statement_jcs":"{\"affiliation\":{\"known_since\":\"2025-12-01T00:00:00.000Z\",\"periods\":[]},\"chain_id\":\"44a5a5ea-3d79-47c9-9535-bc3fda622ea8\",\"forks\":[],\"forks_omitted\":0,\"kind\":\"ledger.anchor_history.v2\",\"next_since_tree_size\":null,\"owner_keys\":[\"1d339e62e060f3bb65063af0308e7f71d8c494d7b08a1f1a3cd615e487f55c8f\"],\"predecessor\":null,\"reference_tree_size\":35,\"roots\":[{\"merkle_root\":\"dba35bea09258b78d170c9207b70d12ec48247b377730f88a7e5614de6039263\",\"recorded_as\":\"countersigned\",\"server_ts\":\"2026-01-01T00:30:01.000Z\",\"tree_size\":15},{\"merkle_root\":\"b254a9023430b278a8bfd039f664b6f29aa220bc40389d332171e481552634ca\",\"recorded_as\":\"countersigned\",\"server_ts\":\"2026-01-01T01:00:01.000Z\",\"tree_size\":28},{\"merkle_root\":\"71aa9ecd3fef1ced03de0aea20d9b50d1624f53afff94b3e12dd0b1aaced7287\",\"recorded_as\":\"countersigned\",\"server_ts\":\"2026-01-01T00:43:00.000Z\",\"tree_size\":34},{\"merkle_root\":\"a3af9387eb35940f96974182b2639a65df08c5b0be59ff93cd82c552b0190a3e\",\"recorded_as\":\"countersigned\",\"server_ts\":\"2026-01-01T00:58:00.000Z\",\"tree_size\":35}],\"server_ts\":\"2026-01-01T01:02:00.000Z\",\"since_tree_size\":0,\"successor\":null,\"truncated\":false}"}
