{"server_key_id":"vendor-statements-test-002","server_signature":"679ea2dfbcf0483c2cd16a9e1b2df8d0b7116c0d062d9a2d2190f4ef704df269072250cb123860f084f0b178ddb32660c0dc41cd3d7748e13e64f2aca6157909","statement":{"affiliation":{"known_since":"2025-12-01T00:00:00.000Z","periods":[]},"chain_id":"698da88d-9984-4637-8d9e-837bcace5ea9","forks":[],"forks_omitted":0,"kind":"ledger.anchor_history.v2","next_since_tree_size":null,"owner_keys":["3145f06aa43e4e6f5db46033f429a65502471a1035c060664138322a7b77b4e8"],"predecessor":null,"reference_tree_size":28,"roots":[{"merkle_root":"944ded7f0f97f6e45b9b9f8a9af9b746dd36e4e052237b55c25cdbe5f6cd5154","recorded_as":"countersigned","server_ts":"2026-01-01T00:30:01.000Z","tree_size":15},{"merkle_root":"f884cf514fa77fb0672682b7271cf3f257d393a1e4dbedaeafbc3ef822d84104","recorded_as":"countersigned","server_ts":"2026-01-01T01:00:01.000Z","tree_size":28}],"server_ts":"2026-01-01T01:02:00.000Z","since_tree_size":0,"successor":null,"truncated":false},"statement_jcs":"{\"affiliation\":{\"known_since\":\"2025-12-01T00:00:00.000Z\",\"periods\":[]},\"chain_id\":\"698da88d-9984-4637-8d9e-837bcace5ea9\",\"forks\":[],\"forks_omitted\":0,\"kind\":\"ledger.anchor_history.v2\",\"next_since_tree_size\":null,\"owner_keys\":[\"3145f06aa43e4e6f5db46033f429a65502471a1035c060664138322a7b77b4e8\"],\"predecessor\":null,\"reference_tree_size\":28,\"roots\":[{\"merkle_root\":\"944ded7f0f97f6e45b9b9f8a9af9b746dd36e4e052237b55c25cdbe5f6cd5154\",\"recorded_as\":\"countersigned\",\"server_ts\":\"2026-01-01T00:30:01.000Z\",\"tree_size\":15},{\"merkle_root\":\"f884cf514fa77fb0672682b7271cf3f257d393a1e4dbedaeafbc3ef822d84104\",\"recorded_as\":\"countersigned\",\"server_ts\":\"2026-01-01T01:00:01.000Z\",\"tree_size\":28}],\"server_ts\":\"2026-01-01T01:02:00.000Z\",\"since_tree_size\":0,\"successor\":null,\"truncated\":false}"}
