{"server_key_id":"vendor-statements-test-001","server_signature":"1f7b50035ec8ec0db65272c794f52994662a86cae8d61f2c55b3a8c62f257f9d83f3c4e0b34cb752be38c1523e94e77aaf210fe8f19465e1fd45af379509d801","statement":{"affiliation":{"known_since":"2025-12-01T00:00:00.000Z","periods":[]},"chain_id":"5fae0d34-2fb0-4772-bc98-d89541f8e06c","forks":[],"forks_omitted":0,"kind":"ledger.anchor_history.v2","next_since_tree_size":null,"owner_keys":["d3b3e076b5ad492938ea3fdfbb6fd97a16b7da58aeda9376400a080f5abfe650"],"predecessor":null,"reference_tree_size":15,"roots":[{"merkle_root":"9c06b2f363be2b3c15046ac934047e1f187083960fee2af9428bb1d6f5bbc195","recorded_as":"countersigned","server_ts":"2026-01-01T00:30:01.000Z","tree_size":15},{"merkle_root":"3920356603f14c01d9ea639005547cf006b7ba52218f420447d7d7c9ff62e7e8","recorded_as":"countersigned","server_ts":"2026-01-01T01:00:01.000Z","tree_size":28}],"server_ts":"2026-01-01T01:02:00.000Z","since_tree_size":0,"successor":null,"truncated":false},"statement_jcs":"{\"affiliation\":{\"known_since\":\"2025-12-01T00:00:00.000Z\",\"periods\":[]},\"chain_id\":\"5fae0d34-2fb0-4772-bc98-d89541f8e06c\",\"forks\":[],\"forks_omitted\":0,\"kind\":\"ledger.anchor_history.v2\",\"next_since_tree_size\":null,\"owner_keys\":[\"d3b3e076b5ad492938ea3fdfbb6fd97a16b7da58aeda9376400a080f5abfe650\"],\"predecessor\":null,\"reference_tree_size\":15,\"roots\":[{\"merkle_root\":\"9c06b2f363be2b3c15046ac934047e1f187083960fee2af9428bb1d6f5bbc195\",\"recorded_as\":\"countersigned\",\"server_ts\":\"2026-01-01T00:30:01.000Z\",\"tree_size\":15},{\"merkle_root\":\"3920356603f14c01d9ea639005547cf006b7ba52218f420447d7d7c9ff62e7e8\",\"recorded_as\":\"countersigned\",\"server_ts\":\"2026-01-01T01:00:01.000Z\",\"tree_size\":28}],\"server_ts\":\"2026-01-01T01:02:00.000Z\",\"since_tree_size\":0,\"successor\":null,\"truncated\":false}"}
