{"server_key_id":"vendor-statements-test-002","server_signature":"3549e34869fad1ca116b5f454dc2c5954f094c606641d3315dae89aaa30edec591824d0c38a2c8fba30b3bb9e29abd3f9977639a2f73b9eeb4a2613dc97d8b02","statement":{"affiliation":{"known_since":"2025-12-01T00:00:00.000Z","periods":[]},"chain_id":"f8cba52d-cd04-441f-99ef-56de7641710e","forks":[],"forks_omitted":0,"kind":"ledger.anchor_history.v2","next_since_tree_size":null,"owner_keys":["6bc388b12a55ead744b3e1a63f72a218092672bf2a6183a9acbe1b8f7c8c0902"],"predecessor":null,"reference_tree_size":15,"roots":[{"merkle_root":"ba8b4f5b7a514213a627198715262ab08ea31202670530f6baf361ff78e53369","recorded_as":"countersigned","server_ts":"2026-01-01T00:30:01.000Z","tree_size":15}],"server_ts":"2026-01-01T00:40:00.000Z","since_tree_size":0,"successor":null,"truncated":false},"statement_jcs":"{\"affiliation\":{\"known_since\":\"2025-12-01T00:00:00.000Z\",\"periods\":[]},\"chain_id\":\"f8cba52d-cd04-441f-99ef-56de7641710e\",\"forks\":[],\"forks_omitted\":0,\"kind\":\"ledger.anchor_history.v2\",\"next_since_tree_size\":null,\"owner_keys\":[\"6bc388b12a55ead744b3e1a63f72a218092672bf2a6183a9acbe1b8f7c8c0902\"],\"predecessor\":null,\"reference_tree_size\":15,\"roots\":[{\"merkle_root\":\"ba8b4f5b7a514213a627198715262ab08ea31202670530f6baf361ff78e53369\",\"recorded_as\":\"countersigned\",\"server_ts\":\"2026-01-01T00:30:01.000Z\",\"tree_size\":15}],\"server_ts\":\"2026-01-01T00:40:00.000Z\",\"since_tree_size\":0,\"successor\":null,\"truncated\":false}"}
