{"server_key_id":"vendor-statements-test-001","server_signature":"b1cd78a3718ae33fdfccf69345b74c6a2fffe5c2be378b08429c870a46f74ca21e8f7db96f5940a1045beb49e9f9952e94d457102645c305c0a13429a44b5a0c","statement":{"affiliation":{"known_since":"2025-12-01T00:00:00.000Z","periods":[]},"chain_id":"5a89a8ad-f3a8-4c9e-a135-6a5f78f44388","forks":[],"forks_omitted":0,"kind":"ledger.anchor_history.v2","next_since_tree_size":null,"owner_keys":["733cb3580c560553d4dabe556392375a70ea67e8c60a0835c77cb02579768033"],"predecessor":null,"reference_tree_size":28,"roots":[{"merkle_root":"2404d8647962792645ac3ea51f26c88f5bb5aa4e6f0bd95a8dca858cded8b657","recorded_as":"countersigned","server_ts":"2026-01-01T00:30:01.000Z","tree_size":15},{"merkle_root":"888038b831b940f5ab8ce0f99513926f2a235bf1c6b261388a6788497e27c1d4","recorded_as":"countersigned","server_ts":"2026-01-01T01:00:01.000Z","tree_size":28}],"server_ts":"2026-01-01T01:02:00.000Z","since_tree_size":0,"successor":{"chain_id":"f7bd0a8b-104f-4dc6-99eb-6f155b0e5333","tree_size":32},"truncated":false},"statement_jcs":"{\"affiliation\":{\"known_since\":\"2025-12-01T00:00:00.000Z\",\"periods\":[]},\"chain_id\":\"5a89a8ad-f3a8-4c9e-a135-6a5f78f44388\",\"forks\":[],\"forks_omitted\":0,\"kind\":\"ledger.anchor_history.v2\",\"next_since_tree_size\":null,\"owner_keys\":[\"733cb3580c560553d4dabe556392375a70ea67e8c60a0835c77cb02579768033\"],\"predecessor\":null,\"reference_tree_size\":28,\"roots\":[{\"merkle_root\":\"2404d8647962792645ac3ea51f26c88f5bb5aa4e6f0bd95a8dca858cded8b657\",\"recorded_as\":\"countersigned\",\"server_ts\":\"2026-01-01T00:30:01.000Z\",\"tree_size\":15},{\"merkle_root\":\"888038b831b940f5ab8ce0f99513926f2a235bf1c6b261388a6788497e27c1d4\",\"recorded_as\":\"countersigned\",\"server_ts\":\"2026-01-01T01:00:01.000Z\",\"tree_size\":28}],\"server_ts\":\"2026-01-01T01:02:00.000Z\",\"since_tree_size\":0,\"successor\":{\"chain_id\":\"f7bd0a8b-104f-4dc6-99eb-6f155b0e5333\",\"tree_size\":32},\"truncated\":false}"}
