{"server_key_id":"vendor-statements-test-001","server_signature":"8a05ba70a8e479abb4b58286cc75e0c873e1eefa01696c86debfb1410e57d38e863db2d257cbb2297e91c8951ad50d5f0b76f90c586c71205d247313aacd070d","statement":{"affiliation":{"known_since":"2025-12-01T00:00:00.000Z","periods":[{"bases":["participation"],"from":"2025-06-01T00:00:00.000Z","merged":false,"recorded_ts":"2025-06-01T00:00:00.000Z","until":"2025-06-04T00:00:00.000Z"},{"bases":["participation"],"from":"2025-06-08T00:00:00.000Z","merged":false,"recorded_ts":"2025-06-01T00:00:00.000Z","until":"2025-06-11T00:00:00.000Z"},{"bases":["participation"],"from":"2025-06-15T00:00:00.000Z","merged":false,"recorded_ts":"2025-06-01T00:00:00.000Z","until":"2025-06-18T00:00:00.000Z"},{"bases":["participation"],"from":"2025-06-22T00:00:00.000Z","merged":false,"recorded_ts":"2025-06-01T00:00:00.000Z","until":"2025-06-25T00:00:00.000Z"},{"bases":["participation"],"from":"2025-06-29T00:00:00.000Z","merged":false,"recorded_ts":"2025-06-01T00:00:00.000Z","until":"2025-07-02T00:00:00.000Z"},{"bases":["participation"],"from":"2025-07-06T00:00:00.000Z","merged":false,"recorded_ts":"2025-06-01T00:00:00.000Z","until":"2025-07-09T00:00:00.000Z"},{"bases":["participation"],"from":"2025-07-13T00:00:00.000Z","merged":false,"recorded_ts":"2025-06-01T00:00:00.000Z","until":"2025-07-16T00:00:00.000Z"},{"bases":["participation"],"from":"2025-07-20T00:00:00.000Z","merged":false,"recorded_ts":"2025-06-01T00:00:00.000Z","until":"2025-07-23T00:00:00.000Z"},{"bases":["participation"],"from":"2025-07-27T00:00:00.000Z","merged":false,"recorded_ts":"2025-06-01T00:00:00.000Z","until":"2025-07-30T00:00:00.000Z"},{"bases":["participation"],"from":"2025-08-03T00:00:00.000Z","merged":false,"recorded_ts":"2025-06-01T00:00:00.000Z","until":"2025-08-06T00:00:00.000Z"},{"bases":["participation"],"from":"2025-08-10T00:00:00.000Z","merged":false,"recorded_ts":"2025-06-01T00:00:00.000Z","until":"2025-08-13T00:00:00.000Z"},{"bases":["participation"],"from":"2025-08-17T00:00:00.000Z","merged":false,"recorded_ts":"2025-06-01T00:00:00.000Z","until":"2025-08-20T00:00:00.000Z"},{"bases":["participation"],"from":"2025-08-24T00:00:00.000Z","merged":false,"recorded_ts":"2025-06-01T00:00:00.000Z","until":"2025-08-27T00:00:00.000Z"},{"bases":["participation"],"from":"2025-08-31T00:00:00.000Z","merged":false,"recorded_ts":"2025-06-01T00:00:00.000Z","until":"2025-09-03T00:00:00.000Z"},{"bases":["participation"],"from":"2025-09-07T00:00:00.000Z","merged":false,"recorded_ts":"2025-06-01T00:00:00.000Z","until":"2025-09-10T00:00:00.000Z"},{"bases":["participation"],"from":"2025-09-14T00:00:00.000Z","merged":false,"recorded_ts":"2025-06-01T00:00:00.000Z","until":null}]},"chain_id":"3c1c13b8-3205-427e-866e-5d5be6fe144c","forks":[],"forks_omitted":0,"kind":"ledger.anchor_history.v2","next_since_tree_size":null,"owner_keys":["5377c98c6867d0910982a136fcea4e72a4bae3b073dbb977c80a5c92dea96c1d"],"predecessor":null,"reference_tree_size":28,"roots":[{"merkle_root":"c66c1eb93863ca38a51684cb79e132e907c4c72e8f2b572567f7a5deb9158cfc","recorded_as":"countersigned","server_ts":"2026-01-01T00:30:01.000Z","tree_size":15},{"merkle_root":"c1921e3ac8eb58bdeb413e1d94abd81acc7d7550bee011fafe9c164bb9ecbddd","recorded_as":"countersigned","server_ts":"2026-01-01T01:00:01.000Z","tree_size":28}],"server_ts":"2026-01-01T01:02:00.000Z","since_tree_size":0,"successor":null,"truncated":false},"statement_jcs":"{\"affiliation\":{\"known_since\":\"2025-12-01T00:00:00.000Z\",\"periods\":[{\"bases\":[\"participation\"],\"from\":\"2025-06-01T00:00:00.000Z\",\"merged\":false,\"recorded_ts\":\"2025-06-01T00:00:00.000Z\",\"until\":\"2025-06-04T00:00:00.000Z\"},{\"bases\":[\"participation\"],\"from\":\"2025-06-08T00:00:00.000Z\",\"merged\":false,\"recorded_ts\":\"2025-06-01T00:00:00.000Z\",\"until\":\"2025-06-11T00:00:00.000Z\"},{\"bases\":[\"participation\"],\"from\":\"2025-06-15T00:00:00.000Z\",\"merged\":false,\"recorded_ts\":\"2025-06-01T00:00:00.000Z\",\"until\":\"2025-06-18T00:00:00.000Z\"},{\"bases\":[\"participation\"],\"from\":\"2025-06-22T00:00:00.000Z\",\"merged\":false,\"recorded_ts\":\"2025-06-01T00:00:00.000Z\",\"until\":\"2025-06-25T00:00:00.000Z\"},{\"bases\":[\"participation\"],\"from\":\"2025-06-29T00:00:00.000Z\",\"merged\":false,\"recorded_ts\":\"2025-06-01T00:00:00.000Z\",\"until\":\"2025-07-02T00:00:00.000Z\"},{\"bases\":[\"participation\"],\"from\":\"2025-07-06T00:00:00.000Z\",\"merged\":false,\"recorded_ts\":\"2025-06-01T00:00:00.000Z\",\"until\":\"2025-07-09T00:00:00.000Z\"},{\"bases\":[\"participation\"],\"from\":\"2025-07-13T00:00:00.000Z\",\"merged\":false,\"recorded_ts\":\"2025-06-01T00:00:00.000Z\",\"until\":\"2025-07-16T00:00:00.000Z\"},{\"bases\":[\"participation\"],\"from\":\"2025-07-20T00:00:00.000Z\",\"merged\":false,\"recorded_ts\":\"2025-06-01T00:00:00.000Z\",\"until\":\"2025-07-23T00:00:00.000Z\"},{\"bases\":[\"participation\"],\"from\":\"2025-07-27T00:00:00.000Z\",\"merged\":false,\"recorded_ts\":\"2025-06-01T00:00:00.000Z\",\"until\":\"2025-07-30T00:00:00.000Z\"},{\"bases\":[\"participation\"],\"from\":\"2025-08-03T00:00:00.000Z\",\"merged\":false,\"recorded_ts\":\"2025-06-01T00:00:00.000Z\",\"until\":\"2025-08-06T00:00:00.000Z\"},{\"bases\":[\"participation\"],\"from\":\"2025-08-10T00:00:00.000Z\",\"merged\":false,\"recorded_ts\":\"2025-06-01T00:00:00.000Z\",\"until\":\"2025-08-13T00:00:00.000Z\"},{\"bases\":[\"participation\"],\"from\":\"2025-08-17T00:00:00.000Z\",\"merged\":false,\"recorded_ts\":\"2025-06-01T00:00:00.000Z\",\"until\":\"2025-08-20T00:00:00.000Z\"},{\"bases\":[\"participation\"],\"from\":\"2025-08-24T00:00:00.000Z\",\"merged\":false,\"recorded_ts\":\"2025-06-01T00:00:00.000Z\",\"until\":\"2025-08-27T00:00:00.000Z\"},{\"bases\":[\"participation\"],\"from\":\"2025-08-31T00:00:00.000Z\",\"merged\":false,\"recorded_ts\":\"2025-06-01T00:00:00.000Z\",\"until\":\"2025-09-03T00:00:00.000Z\"},{\"bases\":[\"participation\"],\"from\":\"2025-09-07T00:00:00.000Z\",\"merged\":false,\"recorded_ts\":\"2025-06-01T00:00:00.000Z\",\"until\":\"2025-09-10T00:00:00.000Z\"},{\"bases\":[\"participation\"],\"from\":\"2025-09-14T00:00:00.000Z\",\"merged\":false,\"recorded_ts\":\"2025-06-01T00:00:00.000Z\",\"until\":null}]},\"chain_id\":\"3c1c13b8-3205-427e-866e-5d5be6fe144c\",\"forks\":[],\"forks_omitted\":0,\"kind\":\"ledger.anchor_history.v2\",\"next_since_tree_size\":null,\"owner_keys\":[\"5377c98c6867d0910982a136fcea4e72a4bae3b073dbb977c80a5c92dea96c1d\"],\"predecessor\":null,\"reference_tree_size\":28,\"roots\":[{\"merkle_root\":\"c66c1eb93863ca38a51684cb79e132e907c4c72e8f2b572567f7a5deb9158cfc\",\"recorded_as\":\"countersigned\",\"server_ts\":\"2026-01-01T00:30:01.000Z\",\"tree_size\":15},{\"merkle_root\":\"c1921e3ac8eb58bdeb413e1d94abd81acc7d7550bee011fafe9c164bb9ecbddd\",\"recorded_as\":\"countersigned\",\"server_ts\":\"2026-01-01T01:00:01.000Z\",\"tree_size\":28}],\"server_ts\":\"2026-01-01T01:02:00.000Z\",\"since_tree_size\":0,\"successor\":null,\"truncated\":false}"}
